{
  "format": "luno.library.export",
  "manifest_version": 1,
  "scope": "library",
  "created_at": "2026-08-10T00:00:00Z",
  "tracks": [
    {
      "ref": "src:one",
      "title": "Song",
      "artist": "Artist",
      "album": "Album",
      "duration_ms": 210000,
      "source": {"provider": "youtube", "id": "abc12345678"},
      "ambiguity_confirmation_required": false
    },
    {
      "ref": "metadata:two",
      "title": "Unknown Recording",
      "artist": "Artist",
      "album": "",
      "duration_ms": 0,
      "source": null,
      "ambiguity_confirmation_required": true
    }
  ],
  "playlists": [
    {"name": "Road Trip", "description": "", "track_refs": ["src:one"]}
  ],
  "unassigned_track_refs": ["metadata:two"]
}
